Имя клиента,Оценка (1–5),Текст отзыва,Дата,Ссылка на источник (Авито)
Иван П.,5,"Быстрая доставка, пилорама собрана аккуратно. Пилим сосну — рез чистый.",2025-01-15,https://www.avito.ru/...
Мария К.,5,"Брали для дачи. Легко понять, как работать, конструкция разборная — удобно.",2025-02-02,https://www.avito.ru/...
Алексей Р.,4,"Двигателя 5 л.с. хватает на бытовые задачи, комплектность ок.",2025-02-20,https://www.avito.ru/...
Сергей Д.,5,"Цена/качество топ. Помогли с настройкой, спасибо!",2025-03-03,https://www.avito.ru/...
Олег С.,5,"Работаем по берёзе и сосне. Геометрия распила ровная, доволен.",2025-03-18,https://www.avito.ru/...
